{
  "schema_version": "1.0.0",
  "review_id": "synthetic-review-007",
  "supersedes_review_id": "synthetic-review-001",
  "decision_id": "synthetic-decision-001",
  "idea_id": "synthetic-idea-001",
  "reviewed_at": "2026-02-21T14:00:00Z",
  "evaluation_window": {
    "started_at": "2026-01-15T14:06:00Z",
    "ended_at": "2026-02-15T14:05:00Z"
  },
  "evidence_cutoff_at": "2026-02-16T14:00:00Z",
  "assessability": "assessable",
  "ex_ante_basis": "verified",
  "evidence_quality": "sufficient",
  "research_outcome": "adverse",
  "decision_quality": "well_supported",
  "process_quality": "mixed",
  "timing_discipline": "followed",
  "invalidation": {
    "trigger_state": "not_triggered",
    "response_state": "not_required",
    "evidence_ids": [],
    "note": "The invented invalidation condition did not occur during the fictional evaluation window."
  },
  "attribution": [
    {
      "factor_id": "synthetic-factor-007",
      "category": "process",
      "direction": "mixed",
      "confidence": "medium",
      "evidence_ids": [
        "synthetic-outcome-evidence-007"
      ],
      "note": "A fictional quality-control review supports a corrected qualitative process category without asserting causality."
    }
  ],
  "evidence_ids": [
    "synthetic-outcome-evidence-007"
  ],
  "assessment_note": "This entirely fictional append-only correction supersedes the prior review while preserving both artifacts and the ex-ante decision.",
  "limitations": []
}
